{
  "asset_meta": {
    "asset_id": "asset-1dc78d04",
    "source_video_id": "video-sample_training_video",
    "title": "sample_training_video.mp4からの自動抽出",
    "purpose": "動画から自動抽出した手順",
    "target_audience": [
      "全員"
    ],
    "target_department": [],
    "prerequisites": [],
    "language": "ja-JP",
    "status": "draft",
    "version": "0.1.0",
    "created_at": "2026-05-27T13:20:39.510591",
    "updated_at": "2026-05-27T13:20:39.510602"
  },
  "instructional_core": {
    "summary": {
      "purpose_summary": "video から自動抽出した手順",
      "outcome_summary": "各ステップに従って操作を実施"
    },
    "chapters": [
      {
        "chapter_id": "chapter-001",
        "title": "抽出された手順",
        "procedures": [
          {
            "procedure_id": "procedure-001",
            "title": "自動抽出手順",
            "steps": [
              {
                "step_id": "step-001",
                "order": 1,
                "action": "これはダミーの文字起こしです。",
                "expected_result": "次のステップへ進む"
              },
              {
                "step_id": "step-002",
                "order": 2,
                "action": "実装の確認用データです。",
                "expected_result": "次のステップへ進む"
              },
              {
                "step_id": "step-003",
                "order": 3,
                "action": "実際の処理は後で統合予定です。",
                "expected_result": "次のステップへ進む"
              }
            ]
          }
        ]
      }
    ],
    "global_cautions": [
      "このデータは自動抽出です",
      "内容を確認し、必要に応じて修正してください"
    ]
  },
  "derived_views": {
    "beginner_view": {
      "title": "新人向け簡易版",
      "key_points": [
        "自動抽出のため、確認が必要です"
      ]
    }
  },
  "_metadata": {
    "schema_version": "0.1.0",
    "generated_at": "2026-05-27T13:20:39.510611",
    "pipeline_version": "0.2.0",
    "generation_context": {
      "mode": "source_evidence_extraction",
      "source": "phase2_extraction"
    },
    "review_status": "unreviewed",
    "review_notes": [
      "自動抽出のため、レビューが必要です"
    ]
  }
}